{
  "task_id": "TASK-000123",
  "parent_task_id": null,
  "assigned_agent": "vendor-assessor",
  "created_at": "2026-03-25T10:30:00Z",
  "priority": "high",
  "objective": "Assess vendor privacy posture for onboarding and identify data residency, access location, and subprocessor issues.",
  "inputs": {
    "vendor_name": "Example Vendor Ltd",
    "documents": [
      "/srv/forgeorchestrate/artifacts/TASK-000123/vendor-security.pdf"
    ],
    "questions": [
      "Where is production data hosted?",
      "Which countries can access support data?",
      "Which subprocessors are listed?"
    ]
  },
  "constraints": {
    "tone": "diplomatic",
    "output_format": "markdown",
    "must_include_sections": [
      "Summary",
      "Risks",
      "Open Questions",
      "Recommendation"
    ]
  },
  "expected_output": {
    "type": "report",
    "path": "/srv/forgeorchestrate/queue/done/TASK-000123.result.json"
  },
  "status": "queued"
}
